{
  "$schema": "https://json-schema.org/draft/2020-12/schema",
  "type": "object",
  "properties": {
    "$schema": {
      "type": "string"
    },
    "version": {
      "type": "string",
      "minLength": 1
    },
    "weights": {
      "type": "object",
      "properties": {
        "kind": {
          "type": "object",
          "properties": {
            "permission": {
              "type": "number",
              "minimum": 0
            },
            "review": {
              "type": "number",
              "minimum": 0
            },
            "question": {
              "type": "number",
              "minimum": 0
            },
            "failure": {
              "type": "number",
              "minimum": 0
            },
            "idle": {
              "type": "number",
              "minimum": 0
            }
          },
          "required": [
            "permission",
            "review",
            "question",
            "failure",
            "idle"
          ],
          "additionalProperties": false
        },
        "age": {
          "type": "number",
          "minimum": 0
        },
        "blocked": {
          "type": "number",
          "minimum": 0
        },
        "urgency": {
          "type": "number",
          "minimum": 0
        }
      },
      "required": [
        "kind",
        "age",
        "blocked",
        "urgency"
      ],
      "additionalProperties": false
    },
    "age": {
      "type": "object",
      "properties": {
        "saturatesAfterMs": {
          "type": "number",
          "exclusiveMinimum": 0
        }
      },
      "required": [
        "saturatesAfterMs"
      ],
      "additionalProperties": false
    },
    "chars": {
      "type": "integer",
      "minimum": 1,
      "maximum": 9007199254740991
    },
    "question": {
      "type": "object",
      "properties": {
        "instructions": {
          "type": "string",
          "minLength": 1
        },
        "levels": {
          "minItems": 4,
          "maxItems": 4,
          "type": "array",
          "items": {
            "type": "string",
            "minLength": 1
          }
        }
      },
      "required": [
        "instructions",
        "levels"
      ],
      "additionalProperties": false
    },
    "floors": {
      "type": "array",
      "items": {
        "type": "object",
        "properties": {
          "when": {
            "$ref": "#/$defs/__schema0"
          },
          "atLeast": {
            "type": "string",
            "enum": [
              "low",
              "normal",
              "high",
              "urgent"
            ]
          },
          "reason": {
            "type": "string",
            "minLength": 1
          }
        },
        "required": [
          "when",
          "atLeast"
        ],
        "additionalProperties": false
      }
    }
  },
  "required": [
    "version",
    "weights",
    "age",
    "chars",
    "question",
    "floors"
  ],
  "additionalProperties": false,
  "$defs": {
    "__schema0": {
      "anyOf": [
        {
          "type": "object",
          "properties": {
            "all": {
              "type": "array",
              "items": {
                "$ref": "#/$defs/__schema0"
              }
            }
          },
          "required": [
            "all"
          ],
          "additionalProperties": false
        },
        {
          "type": "object",
          "properties": {
            "any": {
              "type": "array",
              "items": {
                "$ref": "#/$defs/__schema0"
              }
            }
          },
          "required": [
            "any"
          ],
          "additionalProperties": false
        },
        {
          "type": "object",
          "properties": {
            "not": {
              "$ref": "#/$defs/__schema0"
            }
          },
          "required": [
            "not"
          ],
          "additionalProperties": false
        },
        {
          "type": "object",
          "properties": {
            "eq": {
              "type": "array",
              "prefixItems": [
                {
                  "type": "string",
                  "minLength": 1
                },
                {
                  "$ref": "#/$defs/__schema1"
                }
              ],
              "items": false,
              "minItems": 2,
              "maxItems": 2
            }
          },
          "required": [
            "eq"
          ],
          "additionalProperties": false
        },
        {
          "type": "object",
          "properties": {
            "in": {
              "type": "array",
              "prefixItems": [
                {
                  "type": "string",
                  "minLength": 1
                },
                {
                  "type": "array",
                  "items": {
                    "$ref": "#/$defs/__schema1"
                  }
                }
              ],
              "items": false,
              "minItems": 2,
              "maxItems": 2
            }
          },
          "required": [
            "in"
          ],
          "additionalProperties": false
        },
        {
          "type": "object",
          "properties": {
            "gte": {
              "type": "array",
              "prefixItems": [
                {
                  "type": "string",
                  "minLength": 1
                },
                {
                  "type": "number"
                }
              ],
              "items": false,
              "minItems": 2,
              "maxItems": 2
            }
          },
          "required": [
            "gte"
          ],
          "additionalProperties": false
        },
        {
          "type": "object",
          "properties": {
            "lte": {
              "type": "array",
              "prefixItems": [
                {
                  "type": "string",
                  "minLength": 1
                },
                {
                  "type": "number"
                }
              ],
              "items": false,
              "minItems": 2,
              "maxItems": 2
            }
          },
          "required": [
            "lte"
          ],
          "additionalProperties": false
        },
        {
          "type": "object",
          "properties": {
            "prefix": {
              "type": "array",
              "prefixItems": [
                {
                  "type": "string",
                  "minLength": 1
                },
                {
                  "type": "string"
                }
              ],
              "items": false,
              "minItems": 2,
              "maxItems": 2
            }
          },
          "required": [
            "prefix"
          ],
          "additionalProperties": false
        },
        {
          "type": "object",
          "properties": {
            "suffix": {
              "type": "array",
              "prefixItems": [
                {
                  "type": "string",
                  "minLength": 1
                },
                {
                  "type": "string"
                }
              ],
              "items": false,
              "minItems": 2,
              "maxItems": 2
            }
          },
          "required": [
            "suffix"
          ],
          "additionalProperties": false
        },
        {
          "type": "object",
          "properties": {
            "contains": {
              "type": "array",
              "prefixItems": [
                {
                  "type": "string",
                  "minLength": 1
                },
                {
                  "type": "string"
                }
              ],
              "items": false,
              "minItems": 2,
              "maxItems": 2
            }
          },
          "required": [
            "contains"
          ],
          "additionalProperties": false
        },
        {
          "type": "object",
          "properties": {
            "exists": {
              "type": "string",
              "minLength": 1
            }
          },
          "required": [
            "exists"
          ],
          "additionalProperties": false
        }
      ]
    },
    "__schema1": {
      "anyOf": [
        {
          "type": "string"
        },
        {
          "type": "number"
        },
        {
          "type": "boolean"
        },
        {
          "type": "null"
        },
        {
          "type": "array",
          "items": {
            "$ref": "#/$defs/__schema1"
          }
        },
        {
          "type": "object",
          "propertyNames": {
            "type": "string"
          },
          "additionalProperties": {
            "$ref": "#/$defs/__schema1"
          }
        }
      ]
    }
  }
}
